question,answer,Category,School_Level
How do I set up collaborative whiteboards for remote learning?,"Choose appropriate platforms, provide access credentials, teach collaboration features, establish usage guidelines, and ensure cross-device compatibility.",Remote Learning,All
The biometric attendance system isn't recognizing staff.,"Clean fingerprint scanners, re-enroll user biometrics, check lighting conditions, verify database connectivity, and maintain backup login methods.",Security Systems,All
How do I create digital wellness programs for students?,"Develop screen time awareness, teach digital balance, provide mindfulness apps, create tech-free zones, and monitor student wellbeing.",Digital Wellness,All
Students need help with advanced spreadsheet functions for IB math.,"Provide function tutorials, create practice datasets, teach data visualization, explain statistical analysis, and offer advanced formula help.",Academic Software,IB
The school's hydroponic monitoring system has connectivity issues.,"Check WiFi signals, verify sensor batteries, restart monitoring devices, test data transmission, and maintain growth environment logs.",Agricultural Technology,Secondary/IB
How do I manage technology for students with learning differences?,"Implement assistive technologies, customize interface settings, provide alternative input methods, offer additional training time, and monitor accessibility needs.",Special Education,All
The digital signage throughout school isn't displaying correctly.,"Check network connections, verify content management system, restart display devices, test different content formats, and update display software.",Digital Signage,All
How do I set up coding bootcamps for interested students?,"Choose programming languages, create project-based curriculum, provide development tools, arrange mentorship, and connect with industry professionals.",Coding Education,Secondary/IB
Students are having difficulty with online peer review systems.,"Provide system tutorials, create review guidelines, teach constructive feedback, establish deadlines, and monitor participation levels.",Collaborative Learning,All
The school's 3D modeling software keeps crashing.,"Check system requirements, update graphics drivers, increase available RAM, verify software licenses, and restart graphics services.",Design Software,Secondary/IB
How do I implement digital badges for student achievements?,"Choose badging platforms, create achievement criteria, design badge graphics, establish verification processes, and integrate with student records.",Student Recognition,All
The automated bell system isn't following the correct schedule.,"Check schedule programming, verify time synchronization, test manual override, restart system controller, and maintain backup timing methods.",School Systems,All
How do I create virtual science labs for remote learning?,"Select simulation software, provide lab instructions, ensure safety protocols, enable data collection, and facilitate discussion sessions.",Science Education,All
Students need training on digital portfolio creation.,"Choose portfolio platforms, provide design templates, teach curation skills, establish sharing settings, and connect to career planning.",Career Preparation,Secondary/IB
The school's digital library checkout system is down.,"Restart library software, check database connectivity, verify user accounts, implement manual checkout procedures, and contact vendor support.",Library Systems,All
How do I manage technology for outdoor education programs?,"Select rugged devices, ensure GPS functionality, provide weather protection, establish communication protocols, and plan battery management.",Outdoor Education,All
The interactive floor projection isn't responding to movement.,"Check projector alignment, clean floor surface, calibrate motion sensors, verify software settings, and ensure adequate lighting conditions.",Interactive Technology,Preschool/Elementary
How do I set up digital maker badges for project completion?,"Create skill assessments, design badge criteria, implement verification systems, establish mentorship programs, and connect to industry standards.",Maker Education,Secondary/IB
Students need help with digital collaboration etiquette.,"Teach communication norms, establish online behavior expectations, provide conflict resolution strategies, model appropriate interactions, and create accountability systems.",Digital Citizenship,All
The school's aquaponics monitoring dashboard shows system errors.,"Check sensor calibrations, verify water quality measurements, restart monitoring equipment, test network connectivity, and maintain system balance logs.",Agricultural Technology,Secondary/IB
How do I implement machine learning education for advanced students?,"Provide accessible ML platforms, create hands-on projects, explain ethical implications, connect to career paths, and offer mentorship opportunities.",AI Education,IB
The video conferencing room's audio keeps echoing.,"Adjust microphone sensitivity, reposition speakers, add sound dampening materials, configure echo cancellation, and test audio settings.",Communication Technology,All
How do I create digital time capsules for graduating classes?,"Choose archival platforms, establish contribution guidelines, implement access controls, plan future opening dates, and ensure long-term preservation.",School Traditions,Secondary/IB
Students are struggling with advanced database queries in computer science.,"Provide query examples, create practice databases, explain relationship concepts, offer debugging assistance, and connect to real-world applications.",Computer Science,IB
The school's renewable energy display isn't showing current data.,"Check sensor connections, verify data transmission, restart monitoring software, test network connectivity, and calibrate measurement devices.",Sustainability Education,Secondary/IB
How do I manage technology integration across different learning styles?,"Provide multiple interface options, implement accessibility features, offer varied interaction methods, create personalized learning paths, and monitor student preferences.",Inclusive Education,All
The digital microscopes in biology lab aren't capturing images properly.,"Check camera connections, adjust lighting settings, clean microscope lenses, verify image capture software, and calibrate focus mechanisms.",Science Equipment,Secondary/IB
How do I set up digital mentorship platforms connecting students with professionals?,"Choose secure communication tools, implement safety protocols, establish matching criteria, provide training materials, and monitor interactions.",Career Development,Secondary/IB
Students need help with advanced video editing for media projects.,"Provide software tutorials, teach storytelling techniques, explain technical specifications, offer creative feedback, and showcase exemplary work.",Media Arts,Secondary/IB
The school's smart lighting system isn't responding to occupancy sensors.,"Check sensor connections, verify motion detection settings, restart lighting controllers, test manual override options, and calibrate sensitivity levels.",Facility Technology,All
How do I create immersive virtual field trips to historical sites?,"Research VR content providers, prepare educational materials, coordinate with tour guides, test technology beforehand, and facilitate post-trip discussions.",History Education,All
The robotic vacuum system for cleaning isn't following programmed routes.,"Check navigation sensors, verify floor mapping, restart routing software, remove physical obstacles, and recalibrate positioning systems.",Facility Management,All
How do I implement digital citizenship assessments for different age groups?,"Create age-appropriate scenarios, develop evaluation rubrics, use interactive assessment tools, provide immediate feedback, and track progress over time.",Digital Citizenship,All
Students need advanced statistical software training for research projects.,"Provide software tutorials, create sample datasets, explain statistical concepts, offer analysis guidance, and connect to research methodology.",Research Skills,IB
The school's weather station data isn't syncing with the classroom displays.,"Check data transmission settings, verify network connectivity, restart monitoring software, test display connections, and calibrate weather instruments.",Science Education,All
How do I manage cross-platform compatibility for student devices?,"Test applications across platforms, provide alternative software options, create compatibility guides, offer technical support, and maintain device diversity.",Device Management,All
The digital art tablets aren't pressure-sensitive in design class.,"Update tablet drivers, calibrate pressure settings, check stylus batteries, verify software compatibility, and test different drawing applications.",Arts Technology,Secondary/IB
How do I create digital portfolios that meet IB assessment requirements?,"Research IB guidelines, provide portfolio templates, teach reflection skills, establish submission protocols, and coordinate with IB coordinators.",IB Assessment,IB
Students are having trouble with online collaborative science experiments.,"Provide clear protocols, establish team roles, ensure data sharing capabilities, offer technical support, and facilitate virtual lab sessions.",Science Education,All
The school's automated attendance tracking shows inconsistent data.,"Verify student ID systems, check scanner functionality, review attendance rules, test backup procedures, and validate data accuracy.",Student Information Systems,All
How do I implement coding curriculum for elementary students?,"Choose age-appropriate platforms, create visual programming lessons, provide hands-on activities, encourage creative projects, and assess computational thinking skills.",Computer Science,Elementary
The interactive periodic table display isn't responding to touch inputs.,"Clean touch surface, check connection cables, restart interactive software, calibrate touch points, and verify hardware compatibility.",Science Education,Secondary/IB
How do I manage technology support during standardized testing periods?,"Prepare backup devices, establish support protocols, train additional staff, create emergency procedures, and monitor system performance.",Testing Support,Secondary/IB
Students need help with digital research methodology for extended essays.,"Teach source evaluation, provide database training, explain citation standards, offer research planning tools, and connect with librarians.",Research Skills,IB
The school's solar panel efficiency monitoring shows declining performance.,"Check panel cleanliness, verify inverter functionality, test electrical connections, analyze weather data, and schedule maintenance inspection.",Renewable Energy,Secondary/IB
How do I create engaging digital content for different learning preferences?,"Use multimedia elements, provide interactive features, offer multiple formats, implement accessibility options, and gather student feedback.",Instructional Design,All
The motion sensor lights in classrooms aren't turning on automatically.,"Check sensor sensitivity, verify power connections, test detection zones, adjust timer settings, and clean sensor lenses.",Facility Technology,All
How do I implement peer coding review systems for computer science students?,"Choose collaboration platforms, establish review criteria, teach constructive feedback, create review schedules, and track improvement progress.",Computer Science Education,Secondary/IB
Students are experiencing lag in online multiplayer educational games.,"Check network bandwidth, optimize game settings, use dedicated servers, limit simultaneous users, and implement Quality of Service rules.",Educational Gaming,All
The digital student ID system isn't printing cards properly.,"Check printer connections, verify card stock supply, clean printing mechanisms, update printer drivers, and test card templates.",Student Services,All
