question,answer,Category,School_Level
How do I reset my school email password?,Contact IT help desk or use the password reset link on the login page. You'll need to verify your identity with security questions or phone verification.,Account Management,All
"The projector in my classroom isn't working, what should I do?","Check power cable connections, ensure projector is plugged in, press power button, and verify input source matches your device connection (HDMI/VGA).",Hardware,All
How do I connect to the school WiFi?,"Select the school WiFi network, enter your staff credentials (username/password), or ask IT for the guest network password if needed.",Network,All
"My laptop won't turn on, what's wrong?","Check if battery is charged, try holding power button for 10 seconds, plug in charger and wait 5 minutes, then try powering on again.",Hardware,All
How do I access the student information system?,"Use your web browser to go to the school portal URL, log in with your staff credentials, and navigate to the student information section.",Software,All
The interactive whiteboard isn't responding to touch.,"Check USB connection to computer, restart the interactive whiteboard software, calibrate the touch screen, and ensure drivers are updated.",Hardware,Elementary/Secondary/IB
How do I share files with other teachers?,"Use the school's shared drive, cloud storage system (Google Drive/OneDrive), or email. Ask IT for access permissions to shared folders.",File Management,All
My printer is showing offline status.,"Check printer power and connections, restart printer, ensure WiFi/network connection, and try printing a test page.",Hardware,All
How do I set up video conferencing for parent meetings?,"Use school-approved platforms like Zoom/Teams, schedule meeting in advance, send calendar invites with meeting links to parents.",Communication,All
The computer lab machines are running very slowly.,"Clear temporary files, restart computers, check for virus scans running, close unnecessary programs, and report to IT if issues persist.",Performance,All
How do I backup my important lesson plans?,"Save files to school cloud storage, use USB backup drives, or email files to yourself. Set up automatic backup if available.",Data Management,All
Students can't access the learning management system.,"Verify student login credentials, check if LMS server is running, ensure students are using correct URL, and reset passwords if needed.",Software,All
How do I block inappropriate websites in my classroom?,"Contact IT to configure content filtering, use supervised browsing mode, or install classroom management software to control student access.",Security,All
My microphone isn't working during online classes.,"Check microphone connection, test audio settings, ensure microphone isn't muted, update audio drivers, and try using a different microphone.",Hardware,All
How do I create digital assignments for IB students?,"Use school LMS to create assignments, set deadlines and rubrics, enable file submissions, and provide clear instructions and resources.",Curriculum,IB
The school's gradebook system isn't saving my entries.,"Check internet connection, try refreshing the page, clear browser cache, use a different browser, or contact IT if data loss occurs.",Software,All
How do I set parental controls on classroom iPads?,"Access device management settings, configure app restrictions, set time limits, block inappropriate content, and enable guided access mode.",Device Management,Preschool/Elementary
Students are playing games instead of doing coursework.,"Use classroom management software to monitor screens, block gaming websites, implement usage policies, and configure app restrictions.",Classroom Management,All
How do I troubleshoot audio issues during assemblies?,"Check all cable connections, test microphone levels, ensure speakers are powered on, verify audio input settings, and have backup microphone ready.",Hardware,All
My classroom computer won't connect to the internet.,"Check ethernet/WiFi connection, restart network adapter, try different network, verify IP settings, and test with different device.",Network,All
How do I secure sensitive student data?,"Use encrypted storage, implement strong passwords, limit access permissions, regular backups, and follow school data protection policies.",Security,All
The school website is loading very slowly.,"Clear browser cache, try different browser, check internet speed, contact IT about server performance, and use wired connection if possible.",Performance,All
How do I integrate educational apps with our current system?,"Check app compatibility, review data privacy policies, test integration features, coordinate with IT for installation and user management.",Integration,All
Students forgot their login passwords for online exams.,"Use password reset functionality, verify student identity, temporarily assign new passwords, and document the process for security.",Account Management,Secondary/IB
How do I monitor student progress on digital platforms?,"Use built-in analytics tools, set up progress tracking, generate reports regularly, and integrate with gradebook systems.",Assessment,All
The document camera isn't displaying properly.,"Check video cable connections, adjust focus and lighting, clean camera lens, verify correct input source, and restart camera software.",Hardware,All
How do I create secure online quizzes?,"Use LMS quiz tools, enable lockdown browser, set time limits, randomize questions, enable proctoring features if available.",Assessment,Secondary/IB
My email isn't syncing across devices.,"Check email settings on all devices, verify server configurations, update email apps, ensure proper authentication, and test connectivity.",Communication,All
How do I handle cyberbullying incidents online?,"Document evidence, report to administration, block/restrict users, involve parents, and follow school's digital citizenship policies.",Safety,All
The attendance system isn't working properly.,"Restart attendance software, check network connection, verify time/date settings, update student roster, and contact system administrator.",Software,All
How do I prepare technology for standardized testing?,"Update all devices, install required testing software, check network bandwidth, prepare backup systems, and train staff on procedures.",Testing,Secondary/IB
Students can't submit digital portfolios for IB assessment.,"Check file size limits, verify upload formats, test submission portal, clear browser cache, and provide alternative submission methods.",Assessment,IB
How do I set up a virtual field trip?,"Choose appropriate platform, test technology in advance, coordinate with external providers, prepare backup plans, and brief students on expectations.",Education Technology,All
The school's backup system failed last night.,"Check backup logs, verify storage capacity, test backup media, restart backup service, and implement immediate manual backup.",Data Management,All
How do I configure tablets for special needs students?,"Install accessibility apps, adjust display settings, configure voice controls, set up communication tools, and customize interface layout.",Accessibility,All
My computer keeps freezing during important presentations.,"Close unnecessary programs, check available memory, update graphics drivers, scan for malware, and have backup presentation ready.",Performance,All
How do I manage software licenses for the school?,"Maintain license inventory, track usage numbers, ensure compliance, plan renewals in advance, and negotiate volume discounts.",Licensing,All
Students are accessing social media during class time.,"Configure network filtering, use classroom management tools, implement acceptable use policies, and monitor device usage.",Classroom Management,Secondary/IB
The library's catalog system is down.,"Restart catalog software, check database connectivity, verify server status, try accessing from different computers, and contact vendor support.",Software,All
How do I create digital certificates for student achievements?,"Use digital credentialing platforms, design templates, set up automated distribution, maintain security standards, and track issued certificates.",Digital Credentials,All
My classroom speakers have no sound.,"Check volume levels, verify audio cable connections, test with different audio source, update audio drivers, and check mute settings.",Hardware,All
How do I implement BYOD policies safely?,"Create acceptable use agreements, configure network access controls, install security software, provide user training, and establish support procedures.",Policy,Secondary/IB
The student portal keeps timing out.,"Check session timeout settings, clear browser cookies, try different browser, verify network stability, and contact portal administrator.",Software,All
How do I protect against ransomware attacks?,"Implement regular backups, keep software updated, train staff on phishing, use antivirus software, and restrict user permissions.",Security,All
Students need help with digital research skills.,"Provide training on search techniques, teach source evaluation, introduce citation tools, create research guides, and offer one-on-one support.",Digital Literacy,All
The fire alarm system is interfering with WiFi.,"Check for frequency conflicts, relocate WiFi equipment, use different channels, coordinate with facilities team, and test alternative solutions.",Network,All
How do I manage classroom technology inventory?,"Use asset tracking software, assign device ID numbers, maintain checkout logs, schedule regular audits, and document repairs/replacements.",Inventory,All
Parents can't access the online parent portal.,"Verify login credentials, check account activation status, clear browser cache, provide tutorial materials, and reset passwords if needed.",Communication,All
How do I set up digital storytelling projects?,"Choose appropriate software, provide templates, teach basic editing skills, set file format standards, and create sharing platforms.",Creative Technology,Preschool/Elementary
The network is too slow during peak hours.,"Monitor bandwidth usage, implement Quality of Service rules, upgrade network infrastructure, limit non-essential traffic, and schedule updates during off-hours.",Network,All
How do I ensure IB e-assessment compatibility?,"Test all devices with IB software, update browsers, check system requirements, configure network settings, and prepare backup plans.",Assessment,IB
Students are having trouble with online collaborative projects.,"Provide platform training, set clear collaboration guidelines, troubleshoot sharing permissions, establish communication protocols, and monitor progress.",Collaboration,All
My interactive display is showing connection errors.,"Check HDMI/USB connections, restart display and computer, update display drivers, try different cables, and verify input source settings.",Hardware,All
How do I implement digital citizenship curriculum?,"Develop age-appropriate lessons, use interactive resources, involve parents, create assessment rubrics, and regularly update content.",Digital Citizenship,All
The school's database is running out of storage space.,"Analyze storage usage, archive old data, compress files, upgrade storage capacity, and implement data retention policies.",Data Management,All
How do I troubleshoot video streaming issues?,"Check internet bandwidth, update streaming apps, clear cache, try different browsers, reduce video quality, and test network connectivity.",Multimedia,All
Students need digital portfolios for college applications.,"Choose portfolio platforms, provide templates, teach digital curation skills, ensure accessibility, and help with sharing settings.",Student Services,Secondary/IB
The computer lab needs software updates.,"Schedule maintenance windows, deploy updates remotely, test compatibility, create system backups, and document changes.",Maintenance,All
How do I handle lost or stolen devices?,"Report to administration, remotely wipe data if possible, change associated passwords, track device location, and file insurance claims.",Security,All
Parents want to limit their child's screen time at school.,"Discuss educational technology policies, provide usage reports, suggest home-school coordination, implement time tracking, and offer alternatives.",Communication,All
The online gradebook is showing incorrect calculations.,"Verify grade entry accuracy, check calculation formulas, clear browser cache, test in different browser, and contact gradebook support.",Software,All
How do I create accessible digital content for all students?,"Use proper heading structure, add alt text to images, ensure color contrast, provide captions for videos, and test with screen readers.",Accessibility,All
The school's website was hacked.,"Immediately disconnect from internet, contact cybersecurity experts, change all passwords, restore from clean backups, and notify stakeholders.",Security,All
Students need help with coding projects.,"Provide programming tutorials, set up development environments, offer debugging assistance, create coding challenges, and facilitate peer learning.",STEM Education,Secondary/IB
How do I manage multiple device platforms in one classroom?,"Use cross-platform applications, establish common file formats, provide platform-specific support, maintain consistent policies, and train students on all systems.",Device Management,All
The virtual reality headsets aren't working properly.,"Check battery levels, clean lenses, update VR software, calibrate tracking systems, and ensure adequate play space.",Emerging Technology,Secondary/IB
How do I backup student work automatically?,"Configure cloud sync, set up scheduled backups, use version control systems, educate students on saving practices, and test recovery procedures.",Data Management,All
The online library resources are unavailable.,"Check service status with providers, verify login credentials, clear browser cache, try alternative access methods, and contact vendor support.",Resources,All
How do I integrate AI tools into lesson planning?,"Evaluate educational AI platforms, ensure data privacy compliance, provide teacher training, establish usage guidelines, and monitor effectiveness.",AI Integration,All
Students are experiencing eye strain from screens.,"Adjust screen brightness, promote 20-20-20 rule, ensure proper lighting, encourage breaks, and consider blue light filters.",Health & Safety,All
The school's communication app keeps crashing.,"Clear app cache, update to latest version, restart devices, check available storage space, and contact app developer support.",Communication,All
How do I create digital field trip experiences?,"Research virtual tour platforms, coordinate with content providers, prepare pre/post activities, test technology beforehand, and gather feedback.",Educational Experiences,All
The network bandwidth is insufficient for video calls.,"Limit simultaneous users, upgrade internet plan, use Quality of Service settings, compress video quality, and schedule calls during off-peak hours.",Network,All
How do I manage software updates across all devices?,"Use centralized management systems, schedule automatic updates, test updates before deployment, maintain update logs, and plan rollback procedures.",System Administration,All
Students need digital research databases for IB extended essays.,"Provide database access credentials, conduct training sessions, create research guides, offer citation help, and monitor usage statistics.",Research Support,IB
The smartboard calibration keeps drifting.,"Clean the board surface, check for interference, recalibrate regularly, update drivers, and ensure stable mounting.",Hardware,All
How do I implement gamification in digital learning?,"Choose appropriate platforms, design achievement systems, set clear learning objectives, track student progress, and maintain engagement balance.",Educational Technology,All
The school's cloud storage is nearly full.,"Analyze usage patterns, archive old files, implement storage quotas, upgrade storage plans, and train users on efficient file management.",Cloud Services,All
How do I ensure student data privacy compliance?,"Review privacy policies, implement data minimization, provide staff training, conduct regular audits, and maintain consent documentation.",Data Privacy,All
The online assessment platform is glitching during exams.,"Have backup assessment methods ready, document all issues, contact platform support immediately, communicate with students, and consider exam extensions.",Assessment,All
How do I set up digital bulletin boards for classrooms?,"Choose display software, create content templates, set up automatic updates, train staff on content creation, and maintain regular refreshes.",Classroom Technology,All
Students need help with digital time management tools.,"Introduce calendar applications, teach task prioritization, set up reminder systems, create workflow templates, and monitor student progress.",Digital Skills,Secondary/IB
The 3D printer in the makerspace isn't working.,"Check filament supply, clean print bed, verify file formats, update printer firmware, and perform maintenance calibration.",Makerspace,Secondary/IB
How do I manage tech support tickets efficiently?,"Use ticketing systems, prioritize issues, maintain knowledge bases, track resolution times, and gather user feedback.",IT Management,All
The school's livestream keeps buffering during events.,"Check upload bandwidth, reduce stream quality, use dedicated streaming hardware, test connection stability, and have backup streaming options.",Broadcasting,All
How do I create digital consent forms for parents?,"Use form building platforms, ensure legal compliance, implement electronic signatures, maintain secure storage, and track completion status.",Administration,All
Students are having trouble with online lab simulations.,"Check browser compatibility, update plugins, verify system requirements, provide tutorial resources, and offer technical support.",Science Education,Secondary/IB
The classroom management software isn't blocking websites properly.,"Update filter databases, check category settings, review bypass methods, implement additional security layers, and train students on appropriate use.",Classroom Management,All
How do I integrate IoT devices into STEM lessons?,"Ensure network security, provide programming instruction, create hands-on projects, establish safety protocols, and document learning outcomes.",STEM Education,Secondary/IB
The school's mobile app needs updates.,"Coordinate with developers, test new features, communicate changes to users, plan rollout schedule, and gather user feedback.",Mobile Technology,All
How do I handle technology failures during important presentations?,"Always have backup plans, test equipment beforehand, keep spare cables/adapters, have alternative delivery methods, and remain calm under pressure.",Presentation Technology,All
Students need digital citizenship certificates.,"Create assessment criteria, design certification programs, use digital badging platforms, track completion, and integrate with curriculum standards.",Digital Citizenship,All
The interactive map display isn't responding.,"Check touch screen connections, clean display surface, restart mapping software, calibrate touch points, and verify hardware compatibility.",Hardware,All
How do I manage educational software renewals?,"Maintain renewal calendars, negotiate contract terms, evaluate usage statistics, budget for upgrades, and coordinate with procurement teams.",Software Management,All
The online parent-teacher conference system crashed.,"Switch to backup communication methods, reschedule affected meetings, document technical issues, communicate delays to parents, and contact vendor support immediately.",Communication,All
How do I set up digital maker spaces for younger students?,"Choose age-appropriate tools, implement safety protocols, provide structured activities, train supervising staff, and encourage creative exploration.",Makerspace,Preschool/Elementary
The school's podcast recording equipment isn't working.,"Check microphone connections, verify recording software settings, test audio levels, ensure adequate storage space, and clean equipment connections.",Media Production,All
How do I troubleshoot slow boot times on classroom computers?,"Remove unnecessary startup programs, run disk cleanup, check for malware, defragment hard drives, and consider hardware upgrades.",Performance,All
Students need help with digital storytelling tools.,"Provide software tutorials, create story templates, teach multimedia integration, establish sharing protocols, and encourage peer collaboration.",Creative Technology,All
The emergency notification system isn't sending alerts.,"Test system connectivity, verify contact databases, check message templates, review delivery settings, and coordinate with emergency management.",Safety Systems,All
How do I implement blockchain education for advanced students?,"Research age-appropriate content, provide simulation tools, explain real-world applications, ensure cybersecurity awareness, and connect with industry experts.",Advanced Technology,IB
The school's video production studio has audio sync issues.,"Check audio equipment connections, verify recording settings, test different microphones, adjust delay settings, and calibrate audio/video timing.",Media Production,Secondary/IB
How do I manage guest network access for visitors?,"Create separate guest networks, implement time-limited access, require registration, monitor usage, and maintain security isolation.",Network Management,All
Students are struggling with digital note-taking apps.,"Provide app tutorials, create note-taking templates, teach organization strategies, enable sync across devices, and offer alternative methods.",Study Skills,All
The drone used for aerial photography won't connect.,"Check battery levels, verify remote control pairing, update firmware, ensure clear signal path, and review flight regulations.",STEM/Media,Secondary/IB
How do I set up digital exhibitions for student work?,"Choose presentation platforms, create display templates, set up submission processes, ensure accessibility, and plan virtual opening events.",Student Showcases,All
The school's weather monitoring station is offline.,"Check power connections, verify network connectivity, reset monitoring equipment, test sensor calibration, and contact equipment manufacturer.",Science Equipment,Secondary/IB
How do I manage copyright compliance for digital resources?,"Maintain license databases, educate staff on fair use, implement usage tracking, provide legal alternatives, and conduct regular compliance audits.",Legal Compliance,All
Students need training on digital research ethics.,"Create ethics curriculum, provide case studies, teach proper citation, discuss plagiarism consequences, and model ethical behavior.",Digital Ethics,All
The motion capture system in drama class isn't tracking properly.,"Check lighting conditions, calibrate cameras, verify marker placement, update software, and ensure clear movement space.",Arts Technology,Secondary/IB
How do I implement predictive analytics for student performance?,"Choose appropriate analytics platforms, ensure data privacy, train staff on interpretation, establish intervention protocols, and monitor accuracy.",Data Analytics,All
The school's solar panel monitoring system shows errors.,"Check data connections, verify sensor accuracy, restart monitoring software, inspect physical panels, and contact renewable energy technician.",Sustainability Tech,Secondary/IB
How do I set up digital peer tutoring platforms?,"Select collaboration tools, establish matching criteria, provide training materials, implement safety measures, and track tutoring effectiveness.",Student Support,All
The 360-degree camera for virtual tours isn't stitching properly.,"Check camera positioning, verify software settings, ensure adequate lighting, update stitching software, and clean camera lenses.",Virtual Tours,All
How do I manage technology integration for substitute teachers?,"Create simple instruction guides, provide emergency contacts, set up guest accounts, prepare backup lessons, and offer remote support options.",Substitute Support,All
Students need help with computational thinking skills.,"Introduce problem decomposition, teach pattern recognition, provide algorithm practice, use visual programming tools, and connect to real-world problems.",Computer Science,All
The school's energy monitoring dashboard isn't updating.,"Check sensor connections, verify data transmission, restart monitoring software, test network connectivity, and calibrate measurement devices.",Facility Management,Secondary/IB
How do I create digital escape rooms for learning?,"Choose puzzle creation tools, design educational challenges, implement progress tracking, test difficulty levels, and provide hint systems.",Educational Gaming,All
The telepresence robot for remote students is malfunctioning.,"Check battery charge, verify network connection, restart robot software, test camera/microphone functions, and ensure clear navigation path.",Remote Learning,All
How do I implement augmented reality in lesson plans?,"Select AR platforms, create educational content, ensure device compatibility, provide student training, and assess learning outcomes.",AR/VR Education,Secondary/IB
Students need digital financial literacy tools.,"Choose educational platforms, create budget simulations, teach online safety, provide investment games, and connect to real-world applications.",Life Skills,Secondary/IB
The school's environmental sensors are giving inconsistent readings.,"Calibrate sensor equipment, check for interference, verify placement locations, update monitoring software, and maintain measurement logs.",Environmental Monitoring,All
